{
  "$schema": "https://json-schema.org/draft/2020-12/schema",
  "$id": "https://volatoo.org/schemas/layer-transaction-v1.schema.json",
  "title": "Volatoo layer transaction v1",
  "type": "object",
  "additionalProperties": false,
  "required": [
    "schema",
    "target_id",
    "build_context_digest",
    "build_spec_digest",
    "acquisition_digest",
    "parent_generation_digest",
    "portage",
    "packages",
    "filesystem",
    "world_digest"
  ],
  "properties": {
    "schema": {
      "const": "org.volatoo.layer-transaction/v1"
    },
    "target_id": {
      "$ref": "#/$defs/identifier"
    },
    "build_context_digest": {
      "$ref": "#/$defs/digest"
    },
    "build_spec_digest": {
      "$ref": "#/$defs/digest"
    },
    "acquisition_digest": {
      "$ref": "#/$defs/digest"
    },
    "parent_generation_digest": {
      "$ref": "#/$defs/digest"
    },
    "portage": {
      "type": "object",
      "additionalProperties": false,
      "required": [
        "version",
        "adapter",
        "options"
      ],
      "properties": {
        "version": {
          "type": "string",
          "minLength": 1,
          "maxLength": 128
        },
        "adapter": {
          "const": "emerge-binary-only-v1"
        },
        "options": {
          "type": "array",
          "uniqueItems": true,
          "items": {
            "type": "string",
            "minLength": 1,
            "maxLength": 256
          }
        }
      }
    },
    "packages": {
      "type": "array",
      "minItems": 1,
      "items": {
        "$ref": "#/$defs/package"
      }
    },
    "filesystem": {
      "$ref": "#/$defs/filesystem"
    },
    "world_digest": {
      "$ref": "#/$defs/digest"
    }
  },
  "$defs": {
    "digest": {
      "type": "string",
      "pattern": "^sha256:[0-9a-f]{64}$"
    },
    "identifier": {
      "type": "string",
      "minLength": 3,
      "maxLength": 192,
      "pattern": "^[a-z0-9][a-z0-9._+-]*(/[a-z0-9][a-z0-9._+-]*)+$"
    },
    "package": {
      "type": "object",
      "additionalProperties": false,
      "required": [
        "sequence",
        "cpv",
        "package_digest",
        "artifact_digest",
        "build_id"
      ],
      "properties": {
        "sequence": {
          "type": "integer",
          "minimum": 0
        },
        "cpv": {
          "type": "string",
          "minLength": 1,
          "maxLength": 512,
          "pattern": "^\\S+$"
        },
        "package_digest": {
          "$ref": "#/$defs/digest"
        },
        "artifact_digest": {
          "$ref": "#/$defs/digest"
        },
        "build_id": {
          "type": "string",
          "maxLength": 128
        }
      }
    },
    "filesystem": {
      "type": "object",
      "additionalProperties": false,
      "required": [
        "changed_paths_digest",
        "changed_paths_count",
        "tombstones_digest",
        "tombstones_count",
        "rootfs_digest",
        "rootfs_size",
        "format",
        "builder"
      ],
      "properties": {
        "changed_paths_digest": {
          "$ref": "#/$defs/digest"
        },
        "changed_paths_count": {
          "type": "integer",
          "minimum": 1
        },
        "tombstones_digest": {
          "$ref": "#/$defs/digest"
        },
        "tombstones_count": {
          "type": "integer",
          "minimum": 0
        },
        "rootfs_digest": {
          "$ref": "#/$defs/digest"
        },
        "rootfs_size": {
          "type": "integer",
          "minimum": 1,
          "maximum": 9223372036854775807
        },
        "format": {
          "const": "squashfs"
        },
        "builder": {
          "type": "object",
          "additionalProperties": false,
          "required": [
            "implementation",
            "version",
            "compression",
            "level",
            "block_size",
            "reproducible"
          ],
          "properties": {
            "implementation": {
              "const": "squashfs-tools"
            },
            "version": {
              "const": "4.7.5"
            },
            "compression": {
              "const": "zstd"
            },
            "level": {
              "const": 19
            },
            "block_size": {
              "const": 1048576
            },
            "reproducible": {
              "const": true
            }
          }
        }
      }
    }
  }
}
